{
  "id": "profile-builder",
  "parent_agent": "research-agent",
  "trigger": "/research competitors (after discovery-engine)",
  "single_responsibility": "Extract structured profile data from each competitor site",
  "input": {
    "required": {
      "candidate_competitors": "array<{name, url, niche, confidence_score}> \u2014 from discovery-engine"
    }
  },
  "output": {
    "competitor_profiles": "array<{slug: string, name: string, url: string, niche: string, services: array<string>, contact: {email?, phone?, address?}, socials: {instagram?, linkedin?, facebook?}, positioning_summary: string}>",
    "index_entries": "array<{slug, url, niche, last_scraped: null, sync_enabled: true, status: 'active'}>"
  },
  "validation": {
    "minimum_data_points_per_profile": 3,
    "pii_must_be_redacted": true,
    "no_duplicate_slugs_in_output": true
  },
  "writes": [
    "content/sovereign/scraped/[slug]/info.md",
    "content/sovereign/scraped/index.json"
  ],
  "error_owner": "profile-builder",
  "escalates_to": "research-agent"
}
