{
  "id": "content-parser",
  "parent_agent": "scraper-agent",
  "trigger": "/scrape *, /sync (after ethical-crawler)",
  "single_responsibility": "Convert raw HTML to structured Markdown with metadata",
  "input": {
    "required": {
      "raw_pages": "array<{url, html, status_code, fetched_at}> \u2014 from ethical-crawler"
    }
  },
  "output": {
    "parsed_content": "array<{file_path: string, metadata: {url, title, publish_date, word_count, content_type}, body: string, links: array<string>, image_refs: array<string>}>"
  },
  "validation": {
    "malformed_html_tolerance_percent": 5,
    "skip_and_log_if_parse_fails": true,
    "valid_markdown_required": true
  },
  "writes": [
    "content/sovereign/scraped/[slug]/scraped/content/[type]/[slug].md"
  ],
  "error_owner": "content-parser",
  "escalates_to": "scraper-agent"
}
